,text,category
1422,"bjp use mean get chairmanship jammu kashmir district development council fail secure mandate want ddc election , bjp ally embark campaign bag many council chairmanship possible combination tactic , include coercion , horse-trading preventive detention member people ’ s alliance gupkar declaration .",6
1423,"protein music ! markus buehler others massachusetts institute technology developed system convert molecular structure protein , ba",9
1424,"notify fee structure school , college state level , say andhra pradesh school education body chief < a href= '' http : //timesofindia.indiatimes.com/home/education/news/notify-fee-structure-for-schools-colleges-at-state-level-says-andhra-pradesh-school-education-body-chief/articleshow/.cms '' > < img border= ''  '' hspace= ''  '' align= '' left '' style= '' margin-top:px ; margin-right:px ; '' src= '' http : //timesofindia.indiatimes.com/photo/.cms '' / > < /a >",1
1425,"live cricket score , india v england , rd test , day  < img border= ''  '' hspace= ''  '' align= '' left '' style= '' margin-top:px ; margin-right:px ; '' src= '' http : //timesofindia.indiatimes.com/photo/.cms '' / >",5
1426,"samsung galaxy watch  classic , galaxy watch  galaxy bud  pre-bookings start : offer buyer get < a href= '' http : //timesofindia.indiatimes.com/gadgets-news/samsung-galaxy-watch--classic-galaxy-watch--and-galaxy-buds--pre-bookings-start-all-the-offers-buyers-can-get/articleshow/.cms '' > < img border= ''  '' hspace= ''  '' align= '' left '' style= '' margin-top:px ; margin-right:px ; '' src= '' http : //timesofindia.indiatimes.com/photo/.cms '' / > < /a > samsung announce pre-booking offer recently launch wearable device — galaxy watch  classic , galaxy watch  galaxy bud  — india . device launch company galaxy unpacked event earlier month , along two foldable phone — galaxy z fold  z flip  .",10
1427,"kiit , nit rourkela - rank world university ranking < a href= '' http : //timesofindia.indiatimes.com/home/education/news/kiit-nit-rourkela-in---rank-in-world-university-rankings/articleshow/.cms '' > < img border= ''  '' hspace= ''  '' align= '' left '' style= '' margin-top:px ; margin-right:px ; '' src= '' http : //timesofindia.indiatimes.com/photo/.cms '' / > < /a >",1
1428,"way make picky eater eat well < img border= ''  '' hspace= ''  '' align= '' left '' style= '' margin-top:px ; margin-right:px ; '' src= '' http : //timesofindia.indiatimes.com/photo/.cms '' / > while kid become less picky fussy age , way help picky eater food :",3
1429,'jarvo  ' invades pitch rohit sharma  dismissal < img border= ''  '' hspace= ''  '' align= '' left '' style= '' margin-top:px ; margin-right:px ; '' src= '' http : //timesofindia.indiatimes.com/photo/.cms '' / > daniel jarvis -- also know jarvo  -- invade pitch third day third test india england friday . incident happen india opener rohit sharma dismiss .,5
1430,"forgotten lesson union environment ministry ’ s recent order dilute restriction activity sand quarry ecologically sensitive area western ghat cause concern , especially context flood devastate kerala august .",7
1431,rbi imposes penalty axis bank non-compliance < img border= ''  '' hspace= ''  '' align= '' left '' style= '' margin-top:px ; margin-right:px ; '' src= '' http : //timesofindia.indiatimes.com/photo/.cms '' / >,2
1432,"live cricket score , india v england rd test , day  < img border= ''  '' hspace= ''  '' align= '' left '' style= '' margin-top:px ; margin-right:px ; '' src= '' http : //timesofindia.indiatimes.com/photo/.cms '' / >",5
1433,"ex-director microsoft arm get  year jail < img border= ''  '' hspace= ''  '' align= '' left '' style= '' margin-top:px ; margin-right:px ; '' src= '' http : //timesofindia.indiatimes.com/photo/.cms '' / > former microsoft venture director angel investor mukund mohan sentence two year prison u perpetrate scheme fraudulently obtain covid- disaster relief loan . also order pay fine $ , $ ,, restitution , say u department justice .",2
1434,ddma panel recommends phase-wise reopen school class delhi < a href= '' http : //timesofindia.indiatimes.com/home/education/news/ddma-panel-recommends-phase-wise-reopening-of-schools-for-all-classes-in-delhi/articleshow/.cms '' > < img border= ''  '' hspace= ''  '' align= '' left '' style= '' margin-top:px ; margin-right:px ; '' src= '' http : //timesofindia.indiatimes.com/photo/.cms '' / > < /a >,1
1435,instagram several user across globe < a href= '' http : //timesofindia.indiatimes.com/gadgets-news/instagram-down-for-several-users/articleshow/.cms '' > < img border= ''  '' hspace= ''  '' align= '' left '' style= '' margin-top:px ; margin-right:px ; '' src= '' http : //timesofindia.indiatimes.com/photo/.cms '' / > < /a > photo-sharing website instagram several user . facebook-owned service suffer outage several part world .,10
1436,phonepe get nod account aggregator < img border= ''  '' hspace= ''  '' align= '' left '' style= '' margin-top:px ; margin-right:px ; '' src= '' http : //timesofindia.indiatimes.com/photo/.cms '' / > walmart-owned phonepe say wholly own subsidiary receive in-principle approval operate account aggregator .,2
1437,paradise ferment trek two mountain lake kashmir valley troubled time . trek gangbal nandkulsar lake kashmir pl,11
1438,"neet-mds counsel held august  october  < a href= '' http : //timesofindia.indiatimes.com/home/education/news/neet-mds-counselling-to-be-held-from-august--to-october-/articleshow/.cms '' > < img border= ''  '' hspace= ''  '' align= '' left '' style= '' margin-top:px ; margin-right:px ; '' src= '' http : //timesofindia.indiatimes.com/photo/.cms '' / > < /a > the centre wednesday inform supreme court conduct counsel neet-mds admission august  october  ,  .",1
1439,"wood duck flourish u.s. wood duck one well-recognised celebrate specie waterfowl u.s. threaten extinction , abundant country thanks concert conservation effort year .",7
1440,"‘ the vow ’ s. diwakar : kannada short story translation diwakar ’ s write function simultaneously two planes—fiction metafiction , conjure unusual experience compress pictorial style .",5
1441,"model sustainable living tosamaidan , high-altitude pastureland kashmir ’ s budgam district recently site fire range indian army virtual death trap civilian , today symbol community-driven sustainable living .",7
1442,"unhealthy policy pharmaceutical policy  reduces minimum control drug pricing , thus put health people mercy multinati",8
1443,"medieval splendour bijapur myriad monument bijapur , gol gumbaz , jami masjid , malik-e-maidan ibrahim rauza , continue evoke grandeur past capital city sultanate held sway two century .",5
1444,"hope type diabetes patient besides know b lymphocyte ( type white blood cell ) , workhorse cell adaptive immune system , scientist e",9
1445,malayalam film `` run kalyani '' : patriarchy perspective malayalam film run kalyani make wave realistic depiction romance everyday living .,5
1446,tokyo paralympics live : discus thrower yogesh kathuniya eye gold < img border= ''  '' hspace= ''  '' align= '' left '' style= '' margin-top:px ; margin-right:px ; '' src= '' http : //timesofindia.indiatimes.com/photo/.cms '' / >,4
1447,"‘ aim provide quality tourism ’ interview r.v . deshpande , tourism minister .",11
1448,"govt may withdraw sugar export subsidy new season < img border= ''  '' hspace= ''  '' align= '' left '' style= '' margin-top:px ; margin-right:px ; '' src= '' http : //timesofindia.indiatimes.com/photo/.cms '' / > the government expect withdraw sugar export subsidy new season begin october sharp rise global price make easy mill sell sweetener world market , top government official say tuesday .",2
1449,"bpssc enforcement si admit card release , download here < a href= '' http : //timesofindia.indiatimes.com/home/education/news/bpssc-enforcement-si-admit-card-released-download-here/articleshow/.cms '' > < img border= ''  '' hspace= ''  '' align= '' left '' style= '' margin-top:px ; margin-right:px ; '' src= '' http : //timesofindia.indiatimes.com/photo/.cms '' / > < /a >",1
1450,"would always jadeja team : moeen india play ashwin < img border= ''  '' hspace= ''  '' align= '' left '' style= '' margin-top:px ; margin-right:px ; '' src= '' http : //timesofindia.indiatimes.com/photo/.cms '' / > moeen ali `` little '' surprised r ashwin yet feature ongoing test series india stick one specialist spinner strategy , england offie  pick `` amaze '' ravindra jadeja .",12
1451,"sachin song come crease india chase  , arguably pressure-filled situation team face year . later say hi",4
1452,smvdu receives certificate excellence aicte-internshala < a href= '' http : //timesofindia.indiatimes.com/home/education/news/smvdu-receives-a-certificate-of-excellence-from-aicte-internshala/articleshow/.cms '' > < img border= ''  '' hspace= ''  '' align= '' left '' style= '' margin-top:px ; margin-right:px ; '' src= '' http : //timesofindia.indiatimes.com/photo/.cms '' / > < /a >,1
1453,left cold ashas continue bear burden government  rural health mission new order list incentive-based service .,8
1454,"viral challenge kyasanur forest disease reappear new territory , intensive scientific study need know virus enters forest ecosystem small mammals-tick-monkey-man cycle close bat-tick-bat cycle .",8
1455,"virat kohli middle-order need score , say madan lal < img border= ''  '' hspace= ''  '' align= '' left '' style= '' margin-top:px ; margin-right:px ; '' src= '' http : //timesofindia.indiatimes.com/photo/.cms '' / > former cricketer madan lal pleased india  shambolic batting performance opening day third test england felt team  skipper virat kohli middle-order need find lose form . follow high lord  test win , india  star-studded batting order come cropper wednesday get bundle paltry  opening day match .",5
1456,"film review : 'the great indian kitchen ' discus gender issue patriarchal value relationship malayalam movie 'the great indian kitchen ' address gender issue bring narrative oppressive patriarchal value within community , relationship institution .",5
1457,wimbledon classic roger federers genius give way rafael nadals iron spaniard bridge clay-grass divide . great ever final pro,4
1458,"rd test : high-flying india eye unassailable series lead < img border= ''  '' hspace= ''  '' align= '' left '' style= '' margin-top:px ; margin-right:px ; '' src= '' http : //timesofindia.indiatimes.com/photo/.cms '' / > a supremely confident india look tighten noose around struggle england , captain virat kohli expect overcome prolong lean patch third test five-match series begin wednesday . kohli  last international hundred come november  .",5
1459,companion malayalam short story .,5
1460,treat covid like norovirus – flu < img border= ''  '' hspace= ''  '' align= '' left '' style= '' margin-top:px ; margin-right:px ; '' src= '' http : //timesofindia.indiatimes.com/photo/.cms '' / >,9
1461,"never say want participate olympics , wish touch m mark : sumit < img border= ''  '' hspace= ''  '' align= '' left '' style= '' margin-top:px ; margin-right:px ; '' src= '' http : //timesofindia.indiatimes.com/photo/.cms '' / > tokyo paralympics gold medallist sumit antil thursday clarify never say want participate paris  olympics focus remains touch m mark .",4
1462,"battle democracy thailand countrywide movement , protester battle military-backed government seek fresh election , new constitution protects right , radical reform monarchy .",0
1463,still good position game : overton < img border= ''  '' hspace= ''  '' align= '' left '' style= '' margin-top:px ; margin-right:px ; '' src= '' http : //timesofindia.indiatimes.com/photo/.cms '' / > pacer craig overton friday assert england held ace say first hour  play fourth day go `` massive '' look break india  resistance third test here .,12
1464,"bhavina will-power  able-bodied person , say husband < img border= ''  '' hspace= ''  '' align= '' left '' style= '' margin-top:px ; margin-right:px ; '' src= '' http : //timesofindia.indiatimes.com/photo/.cms '' / > make debut paralympics memorable , india ’ s bhavina patel outclass reign paralympic champion world no .  borislava peric-rankovic serbia enter semifinal woman ’ s single class  event tokyo . continued giant-killing spree saturday , defeat china  world no .  zhang miao place gold-medal match .",4
1465,"govt increase sugarcane frp r /quintal - < img border= ''  '' hspace= ''  '' align= '' left '' style= '' margin-top:px ; margin-right:px ; '' src= '' http : //timesofindia.indiatimes.com/photo/.cms '' / > union cabinet wednesday approve high ever fair remunerative price ( frp ) r  per quintal sugarcane farmer next marketing year start october . briefing medium cabinet meeting , food consumer affair minister piyush goyal say decision benefit  crore sugarcane farmer well  lakh worker employ sugar mill .",2
1466,uniform & equitable supreme court directs tamil nadu government implement uniform system school education immediately . child onl,1
1467,"israel : france ’ s foster child france key contributor project israel lethal , life-destroying remit .",0
1468,"upi volume cross  crore , growth slows < img border= ''  '' hspace= ''  '' align= '' left '' style= '' margin-top:px ; margin-right:px ; '' src= '' http : //timesofindia.indiatimes.com/photo/.cms '' / > unified payment interface ( upi ) transaction volume cross  crore . % surge august , compare previous month , indicate steady e-payments adoption . however , aggressive growth rate value number upi transaction , see taper second wave june july year , moderate august .",2
1469,"moment high drama lie store ahead  tamil nadu assembly election twist turn every corner , run-up tamil nadu assembly election packed suspense intrigue political front lead dmk ruling aiadmk get ready do-or-die battle .",6
1470,first-ever human image pattanam graeco-roman head miniature statue trench produce sphinx another significant artefact  season . happ,5
1471,"nmp protect interest public , consumer : kant < img border= ''  '' hspace= ''  '' align= '' left '' style= '' margin-top:px ; margin-right:px ; '' src= '' http : //timesofindia.indiatimes.com/photo/.cms '' / >",2
1472,"end woman  college ? tamil nadu government  move raze ground -year-old college woman , make way new secretariat complex face",1
1473,"ed reveals ecret underground office ' unitech founder < img border= ''  '' hspace= ''  '' align= '' left '' style= '' margin-top:px ; margin-right:px ; '' src= '' http : //timesofindia.indiatimes.com/photo/.cms '' / > make startle revelation supreme court , enforcement directorate thursday say unearthed “ secret underground office ” operate erstwhile unitech founder ramesh chandra visit son sanjay chandra ajay chandra parole bail .",2
1474,"report baghjan blowout say may take  year even partial recovery destruction cause landscape report impact baghjan blowout assam detail all-round loss people living area , animal plant specie result blatant violation norm close biodiversity hotspot .  well region .",7
1475,"life-saving order pharmaceutical company try persuade government reduce number drug price control , supreme court order directs",8
1476,"instagram confirms , user across globe < a href= '' http : //timesofindia.indiatimes.com/gadgets-news/instagram-down-for-several-users/articleshow/.cms '' > < img border= ''  '' hspace= ''  '' align= '' left '' style= '' margin-top:px ; margin-right:px ; '' src= '' http : //timesofindia.indiatimes.com/photo/.cms '' / > < /a > photo-sharing website instagram several user . facebook-owned service suffer outage several part world .",10
1477,"minoan marvel greek island santorini aegean sea , know ancient name thira , believe volcanic island whose fury destroyed th",11
1478,"deceptive calm west asia precise counterstrike iran u.s. base iraq , two country avoid drastic action although scaling-up rhetoric .",0
1479,"insolvency board seek fairer , quicker process < img border= ''  '' hspace= ''  '' align= '' left '' style= '' margin-top:px ; margin-right:px ; '' src= '' http : //timesofindia.indiatimes.com/photo/.cms '' / > the insolvency bankruptcy board india ( ibbi ) propose major change insolvency process bring discipline transparency address issue come recent case .",2
1480,"azerbaijan armenia military conflict dispute nagorno-karabakh region hostility break azerbaijan armenia nagorno-karabakh , region dispute since  witness many clash decade .",0
1481,sight & sound periyar reserve periyar tiger reserve allure landscape plant animal specie one best conservation programme .,7
1482,"romance adriatic croatia ’ s natural beauty , variety terrain culture make visit history-laden land sheer delight .",11
1483,"team everyone want beat : virat kohli < img border= ''  '' hspace= ''  '' align= '' left '' style= '' margin-top:px ; margin-right:px ; '' src= '' http : //timesofindia.indiatimes.com/photo/.cms '' / > on eve fourth test england oval , virat kohli join teammate taj hotel launch ceremony new exclusive member ' club 'the chamber ' . `` our work relationship , field well , built mutual respect trust , vision share , focus one direction take indian cricket high well place found it , '' say kohli .",5
1484,‘ savara ’ chaudhury hemakanta misra : odia short story translation powerful portrayal travel entertainer small-town odisha .,5
1485,"samsung galaxy tab s fe wifi variant launch india : price , spec more < a href= '' http : //timesofindia.indiatimes.com/gadgets-news/samsung-galaxy-tab-s-fe-wifi-only-variant-launched-in-india-price-specs-and-more/articleshow/.cms '' > < img border= ''  '' hspace= ''  '' align= '' left '' style= '' margin-top:px ; margin-right:px ; '' src= '' http : //timesofindia.indiatimes.com/photo/.cms '' / > < /a > samsung launch new variant galaxy s fe android tablet india . june year , company launch lte variant tablet introduce wifi-only model . wifi version samsung galaxy s fe come similar set specification . company also sell pen box android tablet . tablet come metal unibody weighs  gram . tablet also come dolby atmos support back mah battery .",10
1486,"golden piece relationship advice < img border= ''  '' hspace= ''  '' align= '' left '' style= '' margin-top:px ; margin-right:px ; '' src= '' http : //timesofindia.indiatimes.com/photo/.cms '' / > relationship nothing without hurdle obstacle . every couple face numerous fight argument eventually shape future , whether separate stay together . many try provide piece advice may may help couple . advice may even pose conflict relationship marriage . so , golden piece advice therapist help navigate relationship well .",3
1487,"across zanskar , metre sea level , penzi la may official gateway zanskar , valley embed deep",11
1488,state ‘ positively consider ’ dhe proposal start physical class college student : goa cm < a href= '' http : //timesofindia.indiatimes.com/home/education/news/state-will-positively-consider-dhe-proposal-to-start-physical-classes-for-college-students-goa-cm/articleshow/.cms '' > < img border= ''  '' hspace= ''  '' align= '' left '' style= '' margin-top:px ; margin-right:px ; '' src= '' http : //timesofindia.indiatimes.com/photo/.cms '' / > < /a >,1
1489,"west bengal : right-wing rant west bengal bjp president dilip ghosh keep barrage aggressive comment , make sure party remains public eye main opposition state .",6
1490,"india beaten despite 'bad day ' , say mohammed siraj < img border= ''  '' hspace= ''  '' align= '' left '' style= '' margin-top:px ; margin-right:px ; '' src= '' http : //timesofindia.indiatimes.com/photo/.cms '' / > rid high win second test lord  , india skittle wednesday  day one late five match series . england end day two / thanks captain root '  half-century rory burn (  ) , haseeb hameed (  ) dawid malan (  ) .",5
1491,"move win future career advance , koneru humpy need play prowess sharpen appropriate adequate training . th",4
1492,"gutted rule test series , broad focus ash < img border= ''  '' hspace= ''  '' align= '' left '' style= '' margin-top:px ; margin-right:px ; '' src= '' http : //timesofindia.indiatimes.com/photo/.cms '' / > after rule ongoing home test series india due calf injury , `` gutted '' stuart broad say take time recuperate prepare ash , schedule begin december .",5
1493,"`` i cinnamon water boost metabolism '' < img border= ''  '' hspace= ''  '' align= '' left '' style= '' margin-top:px ; margin-right:px ; '' src= '' http : //timesofindia.indiatimes.com/photo/.cms '' / > balu margale , work professional become victim disorderly eat habit largely sedentary lifestyle . come face face reality inch closer -kilo mark , instantly regret damage do health work correct lifestyle",3
1494,aesthetic impermanence fragrance blossom thick air call ecstatic bird fill ear . sujata chatterji wonderful  day,11
1495,"top world , indescribable , say avani lekhara < img border= ''  '' hspace= ''  '' align= '' left '' style= '' margin-top:px ; margin-right:px ; '' src= '' http : //timesofindia.indiatimes.com/photo/.cms '' / > a car accident  left avani lekhara wheelchair-bound monday shooter felt `` on top world '' become first indian woman snare paralympic gold medal .",4
1496," may turn india  year ipo : rbi article < img border= ''  '' hspace= ''  '' align= '' left '' style= '' margin-top:px ; margin-right:px ; '' src= '' http : //timesofindia.indiatimes.com/photo/.cms '' / > the year  could turn india  year ipo domestic unicorn public issue set `` domestic stock market fire global investor frenzy '' , rbi article say tuesday .",2
1497,"full india schedule result tokyo paralympics < img border= ''  '' hspace= ''  '' align= '' left '' style= '' margin-top:px ; margin-right:px ; '' src= '' http : //timesofindia.indiatimes.com/photo/.cms '' / > have witness successful olympics ever seven medal , india field big contingent tokyo paralympics schedule held august  september  .  athlete set compete nine sport discipline -- archery , athletics , badminton , canoe , shoot , swim , powerlifting , table tennis taekwondo .",4
1498,"search endanger snow leopard , upper spiti valley himachal pradesh nature conservation foundation do commendable work past two decade protect snow leopard upper spiti valley himachal pradesh , effort concerned need overcome threat big cat face range .",7
1499,"anti-hero icon kirk douglas ( - ) , one unlikeliest superstar golden age hollywood , open new creative possibility lead actor choice role craft .",5
1500,quota confusion supreme court order status quo admission already make karnataka refers state government  new law large bench .,1
1501,"star dust antarctica scientist found particle rare isotope iron ( fe- ) antarctica snow , believe could originate nearby supernova .",9
1502,"suneet varma stuns icw  < img border= ''  '' hspace= ''  '' align= '' left '' style= '' margin-top:px ; margin-right:px ; '' src= '' http : //timesofindia.indiatimes.com/photo/.cms '' / > couturier suneet varma showcased couture collection , 'noor ' fdci  second digital edition india couture week . collection saw beautiful pastel embroider delicate bead , crystal thread-work bridal red intricate gold thread work silver zardozi .",3
1503,"pharma exporter stare afghan uncertainty ; $ m target blink < img border= ''  '' hspace= ''  '' align= '' left '' style= '' margin-top:px ; margin-right:px ; '' src= '' http : //timesofindia.indiatimes.com/photo/.cms '' / > a uncertainty loom large afghanistan , indian pharma exporter apprehensive send good war-torn country target export $  million worth pharmaceutical good taliban-ruling nation depends future outcome .",2
1504,"best bridal beauty look < img border= ''  '' hspace= ''  '' align= '' left '' style= '' margin-top:px ; margin-right:px ; '' src= '' http : //timesofindia.indiatimes.com/photo/.cms '' / > from sparkly , glittery eye shadow arty filigree forehead , here  caught attention recently conclude couture week .",3
1505,"intrigue shadow centre girish kasaravalli  nayee neralu character venkatalaxmi , us superstitious belief subvert tradition . ( publish issue date september  ,  . )",5
1506,"bowler help bangladesh claim first t win new zealand < img border= ''  '' hspace= ''  '' align= '' left '' style= '' margin-top:px ; margin-right:px ; '' src= '' http : //timesofindia.indiatimes.com/photo/.cms '' / > bangladesh beat new zealand first time twenty international , skittle kiwi  first match wednesday .",12
1507,bt cotton match indian pest first long-term analysis impact bt cotton india found production gain due change insecticide fertilizer use,9
1508,"destination croatia croatia ’ s natural beauty , variety terrain culture make visit history-laden land sheer delight .",11
1509,"give rishabh pant space need , say virat kohli < img border= ''  '' hspace= ''  '' align= '' left '' style= '' margin-top:px ; margin-right:px ; '' src= '' http : //timesofindia.indiatimes.com/photo/.cms '' / > india skipper virat kohli saturday back under-fire wicketkeeper rishabh pant , say team management give space need remainder five-test series england .",4
1510,"‘ i don ’ t associate language religion ’ interview raziya mohammed kutty , sanskrit teacher .",1
1511,"change neet-ug date , say ministry education < a href= '' http : //timesofindia.indiatimes.com/home/education/news/neet--no-change-in-neet-ug-dates-says-ministry-of-education/articleshow/.cms '' > < img border= ''  '' hspace= ''  '' align= '' left '' style= '' margin-top:px ; margin-right:px ; '' src= '' http : //timesofindia.indiatimes.com/photo/.cms '' / > < /a > accord official ministry education , change neet-ug date delay exam least   day due logistical issue may also result indefinite delay due uncertainty .",1
1512,maharashtra ’ s green signal environment state board wildlife undertook several significant positive decision late meeting promise far-reaching benefit ecology wildlife maharashtra .,7
