,text,category
0,"security cooperation high blinken ’ s agenda two-day india visit july , u.s. secretary state antony blinken , third senior official biden administration visit india since january , take forward washington ’ s policy strengthen military alliance india , important ally anti-china coalition region .",0
1,"du organises music festival memory father-son sitar duo pt . debu chaudhuri , prateek < a href= '' http : //timesofindia.indiatimes.com/home/education/news/du-organises-music-festival-in-memory-of-father-son-sitar-duo-pt-debu-chaudhuri-prateek/articleshow/.cms '' > < img border= ''  '' hspace= ''  '' align= '' left '' style= '' margin-top:px ; margin-right:px ; '' src= '' http : //timesofindia.indiatimes.com/photo/.cms '' / > < /a >",1
2,"vacancy cloud tech  % high demand < img border= ''  '' hspace= ''  '' align= '' left '' style= '' margin-top:px ; margin-right:px ; '' src= '' http : //timesofindia.indiatimes.com/photo/.cms '' / > driven pandemic ,  saw immense growth demand cloud role globally . india record total , job posting cloud role ,  % increase  , nasscom report partnership accenture tc said.​",2
3,small change improve mundane life < img border= ''  '' hspace= ''  '' align= '' left '' style= '' margin-top:px ; margin-right:px ; '' src= '' http : //timesofindia.indiatimes.com/photo/.cms '' / > small change improve mundane life,3
4,act courage shane warne  dramatic exit world cup overshadow one courageous act protest see sport arena long ti,4
5,"isolate brathwaite risk miss jamaica tallawahs  cpl opener < img border= ''  '' hspace= ''  '' align= '' left '' style= '' margin-top:px ; margin-right:px ; '' src= '' http : //timesofindia.indiatimes.com/photo/.cms '' / > west indie all-rounder carlos brathwaite risk miss jamaica tallawahs ' opening match caribbean premier league ( cpl ) force self-isolate follow covid- case flight st kitts nevis , accord medium report .",5
6,"control aggression work u leeds test : chris silverwood < img border= ''  '' hspace= ''  '' align= '' left '' style= '' margin-top:px ; margin-right:px ; '' src= '' http : //timesofindia.indiatimes.com/photo/.cms '' / > england head coach chris silverwood sunday say `` control aggression '' contribute immensely series-levelling win india third test , day player let emotion get well lord  .",4
7,messi make psg debut mbappe steal show < img border= ''  '' hspace= ''  '' align= '' left '' style= '' margin-top:px ; margin-right:px ; '' src= '' http : //timesofindia.indiatimes.com/photo/.cms '' / > lionel messi come substitute make paris saint-germain debut sunday kylian mbappe stole show score goal - win reims ligue  .,4
8,"alternative model predict electoral outcome opinion poll exit poll usual exercise election kindle voter ’ politician ’ curiosity equally . usually , sampl",6
9,story mother interview tamil writer perumal murugan .,5
10,"'kohli lovely , welcome guy passionate win ' < img border= ''  '' hspace= ''  '' align= '' left '' style= '' margin-top:px ; margin-right:px ; '' src= '' http : //timesofindia.indiatimes.com/photo/.cms '' / > virat kohli intense aggressive field nice welcome , accord royal challenger bangalore teammate new zealand pacer kyle jamieson .",5
11,"india crumble due relentless pressure england : kohli < img border= ''  '' hspace= ''  '' align= '' left '' style= '' margin-top:px ; margin-right:px ; '' src= '' http : //timesofindia.indiatimes.com/photo/.cms '' / > india  meek surrender first inning third test `` bizarre '' skipper virat kohli , say crumble face relentless pressure create england bowler . india lose leeds test inning  run england level five-match series -. kohli admit  , always play catch-up game .",4
12,diy foot scrub crack heel < img border= ''  '' hspace= ''  '' align= '' left '' style= '' margin-top:px ; margin-right:px ; '' src= '' http : //timesofindia.indiatimes.com/photo/.cms '' / > have crack heel common problem mean ca n't mend crack .,3
13,cristiano ronaldo wear manchester united  no .  shirt < img border= ''  '' hspace= ''  '' align= '' left '' style= '' margin-top:px ; margin-right:px ; '' src= '' http : //timesofindia.indiatimes.com/photo/.cms '' / > cristiano ronaldo wear manchester united  iconic number seven edinson cavani agree surrender shirt . ronaldo follow long list united legend worn number seven first spell united   .,4
14,"siligi seven cub sight litter seven cheetah cub last year masai mara national reserve kenya cause much cheer . sadly , two cub remain , therein perhaps lie story conservation go wrong big cat unmatched elegance “ excite spectacle ” hunt .",7
15,"india  return form ? indifferent start world cup campaign , india show encourage sign return form . somewhat quiet",4
16,"ail orissa contaminate water source virtual absence health care claim dozen life state , grip cholera . bhub",8
17, student  govt school test positive covid- < a href= '' http : //timesofindia.indiatimes.com/home/education/news/-students-from--govt-schools-test-positive-for-covid-/articleshow/.cms '' > < img border= ''  '' hspace= ''  '' align= '' left '' style= '' margin-top:px ; margin-right:px ; '' src= '' http : //timesofindia.indiatimes.com/photo/.cms '' / > < /a >,1
18,"denture ? grow new teethscientists japan manage grow teeth stem cell , development could make denture redundant .",8
19,"tip raise successful kid , per science < img border= ''  '' hspace= ''  '' align= '' left '' style= '' margin-top:px ; margin-right:px ; '' src= '' http : //timesofindia.indiatimes.com/photo/.cms '' / > success depends many factor , per psychologist , raise child important role play it .",3
20,"nd test : rohit , rahul register -run opening stand < img border= ''  '' hspace= ''  '' align= '' left '' style= '' margin-top:px ; margin-right:px ; '' src= '' http : //timesofindia.indiatimes.com/photo/.cms '' / > india opening batter rohit sharma kl rahul register -run opening stand england opening day ongoing second test lord  cricket ground thursday . first time india  opening batter put  run test played outside asia since . also high first-innings opening partnership india lord  since  .",5
21,"bald black hole accord albert einstein ’ s theory general relativity , black hole , born collision two massive black hole , “ ring ” af",9
22,"afghanistan : relief agreement sign u.s. taliban february  , see withdrawal u.s. troop afghanistan , may finally bring relief long-suffering afghan people .",0
23,"bhu introduce degree course hinduism < a href= '' http : //timesofindia.indiatimes.com/home/education/news/bhu-to-introduce-degree-course-in-hinduism/articleshow/.cms '' > < img border= ''  '' hspace= ''  '' align= '' left '' style= '' margin-top:px ; margin-right:px ; '' src= '' http : //timesofindia.indiatimes.com/photo/.cms '' / > < /a > for first time , hinduism taught subject banaras hindu university ( bhu ) student learn ancient knowledge , tradition , art , science skill course .",1
24,union bank india recruitment  : application process begin  specialist officer vacancy < a href= '' http : //timesofindia.indiatimes.com/home/education/news/union-bank-of-india-recruitment--application-process-begins-for--specialist-officer-vacancies/articleshow/.cms '' > < img border= ''  '' hspace= ''  '' align= '' left '' style= '' margin-top:px ; margin-right:px ; '' src= '' http : //timesofindia.indiatimes.com/photo/.cms '' / > < /a >,1
25,"infectious covid- variant real possibility ? < img border= ''  '' hspace= ''  '' align= '' left '' style= '' margin-top:px ; margin-right:px ; '' src= '' http : //timesofindia.indiatimes.com/photo/.cms '' / > warn inevitable threat must prepared for , covid- trend social medium . truth it ?",3
26,opaqueness india ’ s national task force covid- show government prepare second wave pandemic fact india know name  member national task force covid- emblematic colossal failure task force—whose job seem endorse decision political masters—and government prepare take step mitigate inevitable second wave pandemic . task force take task laxity negligence ?,8
27,redmi  prime redmi beat drop launch india today pm : watch live stream < a href= '' http : //timesofindia.indiatimes.com/gadgets-news/redmi--prime-and-redmibeat-drop-to-launch-in-india-today-at-pm-how-to-watch-live-stream/articleshow/.cms '' > < img border= ''  '' hspace= ''  '' align= '' left '' style= '' margin-top:px ; margin-right:px ; '' src= '' http : //timesofindia.indiatimes.com/photo/.cms '' / > < /a >,10
28,"madness , non-selection ashwin great non-selection uk : vaughan < img border= ''  '' hspace= ''  '' align= '' left '' style= '' margin-top:px ; margin-right:px ; '' src= '' http : //timesofindia.indiatimes.com/photo/.cms '' / > former england skipper michael vaughan thursday term non-selection off-spinner ravichandran ashwin indian lineup `` madness '' . ashwin feature four test england far omission huge debate point across cricket fraternity .",4
29,"'chosen ' one : rajinikanth break monopoly dravidian politics tamil nadu ? much waver keep fan suspense two decade rajinikanth decide enter politics . political , ideological organisational strength break monopoly dravidian politics tamil nadu , bjp hope achieve apparently rid tinsel town popularity ?",6
30,"paralympics : devendra jhajharia dedicates silver medal late father < img border= ''  '' hspace= ''  '' align= '' left '' style= '' margin-top:px ; margin-right:px ; '' src= '' http : //timesofindia.indiatimes.com/photo/.cms '' / > more colour medal , stand podium matter devendra jhajharia tokyo paralympics .",4
31,"emma goldman m.n . roy : last legacy retrieval forgotten narrative emma goldman m.n . roy , tower personality time , help u chart utopian vista could relevant time ?",5
32,apple may face cci probe in-app payment issue < img border= ''  '' hspace= ''  '' align= '' left '' style= '' margin-top:px ; margin-right:px ; '' src= '' http : //timesofindia.indiatimes.com/photo/.cms '' / >,2
33,"india-australia woman  pink-ball test venue shift < img border= ''  '' hspace= ''  '' align= '' left '' style= '' margin-top:px ; margin-right:px ; '' src= '' http : //timesofindia.indiatimes.com/photo/.cms '' / > toi learnt historic one-off pink-ball woman ’ s test india australia , schedule begin sept  , move waca perth carrara stadium ( know commercially metricon stadium ) gold coast queensland .",5
34,maharashtra ’ s ruling maha vikas aghadi coalition go rocky patch maharashtra ’ s ruling coalition go rocky patch amid rumour sena bjp come together again .,6
35,"freeze vegetable home < img border= ''  '' hspace= ''  '' align= '' left '' style= '' margin-top:px ; margin-right:px ; '' src= '' http : //timesofindia.indiatimes.com/photo/.cms '' / > if fond cooking often find difficult get fresh vegetable off-season , follow below-given step step instruction freeze vegetable home .",3
36,"first ever stable ring pure carbon pure carbon know come several configuration , call allotrope chemistry . carbon atom bond three atom form",9
37,dome grandeur russia  church fine example religious architecture . text photograph sudha mahalingam,11
38,nd test live : rain force early lunch day  ; india / < img border= ''  '' hspace= ''  '' align= '' left '' style= '' margin-top:px ; margin-right:px ; '' src= '' http : //timesofindia.indiatimes.com/photo/.cms '' / >,5
39,death iit-m campus student ’ s death iit madras campus brings fore serious structural malaise institute .,1
40," zodiac sign make best friend < img border= ''  '' hspace= ''  '' align= '' left '' style= '' margin-top:px ; margin-right:px ; '' src= '' http : //timesofindia.indiatimes.com/photo/.cms '' / > want know person become best friend , astrology help this . look  zodiac sign make best friend .",3
41,cdlu sirsa start new course medium current session < a href= '' http : //timesofindia.indiatimes.com/home/education/news/cdlu-sirsa-starts-new-course-in-media-from-current-session/articleshow/.cms '' > < img border= ''  '' hspace= ''  '' align= '' left '' style= '' margin-top:px ; margin-right:px ; '' src= '' http : //timesofindia.indiatimes.com/photo/.cms '' / > < /a >,1
42,"rajasthan pre d.el.ed . exam admit card  release ; here  direct link < a href= '' http : //timesofindia.indiatimes.com/home/education/news/rajasthan-pre-d-el-ed-exam-admit-card--released-download-here/articleshow/.cms '' > < img border= ''  '' hspace= ''  '' align= '' left '' style= '' margin-top:px ; margin-right:px ; '' src= '' http : //timesofindia.indiatimes.com/photo/.cms '' / > < /a > candidate , apply pre d. el . ed . examination , download hall ticket official website - predeled.com .",1
43,"important people tend criticise : ajinkya rahane < img border= ''  '' hspace= ''  '' align= '' left '' style= '' margin-top:px ; margin-right:px ; '' src= '' http : //timesofindia.indiatimes.com/photo/.cms '' / > india vice-captain ajinkya rahane , last come lengthy lean patch crucial  second inning lord  test , react sarcasm ask perennially scrutiny .",5
44,"soccer ’ s turn under- fifa world cup , india host , huge success , give game big boost country .",4
45,"glorious quetzal photographic encounter elusive bird cloud forest costa rica , resplendent quetzal .",7
46,"infosys becomes th indian co touch $ bn m-cap < img border= ''  '' hspace= ''  '' align= '' left '' style= '' margin-top:px ; margin-right:px ; '' src= '' http : //timesofindia.indiatimes.com/photo/.cms '' / > infosys ltd tuesday become fourth indian company touch market valuation $  billion . service major join league tc , reliance industry hdfc bank cross $  billion-mark term market capitalisation .",2
47,trigger cuban crisis protest cuba trigger economic downturn facilitate great extent united state government influential anti-cuba lobby florida .,0
48,co-publishing venture open new vista tamil literature translation literature-in-translation programme support tamil nadu textbook educational service corporation collaboration india ’ s lead publisher seek open new vista tamil literature culture english .,5
49,"horse & elephant help india first test win eng < img border= ''  '' hspace= ''  '' align= '' left '' style= '' margin-top:px ; margin-right:px ; '' src= '' http : //timesofindia.indiatimes.com/photo/.cms '' / > when england india meet oval fourth test thursday ,  year since india  triumph south london ground saw first match series win english soil .",12
50,"deadbeat detroit once-prosperous u city challenge , question capitalism throw face . text photograph : sudhanva deshpande",11
51,gavaskar wonder pant told change stance umpire < img border= ''  '' hspace= ''  '' align= '' left '' style= '' margin-top:px ; margin-right:px ; '' src= '' http : //timesofindia.indiatimes.com/photo/.cms '' / > the legendary sunil gavaskar baffle english umpire object rishabh pant  stance stand outside crease ongoing third test england feel rule prevent so .,5
52,u.s. foreign policy joe biden greatly different past joe biden foreign policy goal u.s. primacy remain . end u.s. continue undermine tie china russia establish country iran venezuela .,0
53,"sachin  feat fitting tribute master batsman , sachin tendulkar adjudge man tournament icc cricket world cup , . nelso",4
54,unhealthy care hospital india generally lackadaisical follow stringent patient safety infection-control standard . hospital india,8
55,"in-host mutation covid- virus reflect variant , find study < img border= ''  '' hspace= ''  '' align= '' left '' style= '' margin-top:px ; margin-right:px ; '' src= '' http : //timesofindia.indiatimes.com/photo/.cms '' / >",9
56,"foreign policy challenge u.s. president joe biden face asia even asia remains important frontline united state president joe biden ’ s foreign policy , clear indication administration continue , perhaps even deepen , u.s ’ hybrid war china .",0
57,"government run option face resolute farmer ' agitation agitate farmer reject government ’ s ‘ abeyance ploy ’ , leave bjp room save face , opposition get ready grill ruling alliance upcoming budget session parliament .",6
58,"dell launch new alienware x-series , xps g laptop , price start r , < a href= '' http : //timesofindia.indiatimes.com/gadgets-news/dell-launches-new-alienware-x-series-xps-and-g-laptops-price-starts-rs-/articleshow/.cms '' > < img border= ''  '' hspace= ''  '' align= '' left '' style= '' margin-top:px ; margin-right:px ; '' src= '' http : //timesofindia.indiatimes.com/photo/.cms '' / > < /a > the new lineup comprises alienware ’ s thinnest laptop date , late dell g game series new xps series laptop .",10
59,"cloud cricket subcontinent  popular sport sully allegation match-fixing , drag name many esteem cricketer",4
60,"iranian nuclear physicist mohsen fakhrizadeh  kill point israel  murderous game plan assassination iranian nuclear physicist mohsen fakhrizadeh , israeli u.s. hit list time , apparently part strategy sabotage incoming biden administration ’ s plan revive iran nuclear deal .",0
61,achieve excellence professional education < a href= '' http : //timesofindia.indiatimes.com/home/education/news/achieving-excellence-in-professional-education/articleshow/.cms '' > < img border= ''  '' hspace= ''  '' align= '' left '' style= '' margin-top:px ; margin-right:px ; '' src= '' http : //timesofindia.indiatimes.com/photo/.cms '' / > < /a >,1
62,"zimbabwe spinner roy kaia  action found illegal , suspend < img border= ''  '' hspace= ''  '' align= '' left '' style= '' margin-top:px ; margin-right:px ; '' src= '' http : //timesofindia.indiatimes.com/photo/.cms '' / > the international cricket council ( icc ) tuesday announce zimbabwe  roy kaia suspend bowling international cricket immediate effect independent assessment found bowling action illegal .",5
63,"sbi raise r , crore at bond < img border= ''  '' hspace= ''  '' align= '' left '' style= '' margin-top:px ; margin-right:px ; '' src= '' http : //timesofindia.indiatimes.com/photo/.cms '' / > the state bank india ( sbi ) raise r , crore additional tier- ( at ) bond , offering coupon rate . % . come close heel hdfc bank raise $  billion issue at bond international market .",2
64,"covid second wave : andhra pradesh caught unawares overwhelmed sudden spate infection , government ramp hospital facility augments tele-consultation bid optimise bed usage , even struggle vaccine paucity .",8
65,"india allows boeing  max fly again < img border= ''  '' hspace= ''  '' align= '' left '' style= '' margin-top:px ; margin-right:px ; '' src= '' http : //timesofindia.indiatimes.com/photo/.cms '' / > the directorate general civil aviation ( dgca ) thursday allow boeing  max fly indian airspace again , carry require safety modification . boeing  max plane ground globally march  two crash within  month .",2
66,"mark wood , chris woakes available selection fourth test < img border= ''  '' hspace= ''  '' align= '' left '' style= '' margin-top:px ; margin-right:px ; '' src= '' http : //timesofindia.indiatimes.com/photo/.cms '' / > pacer mark wood all-rounder chris woakes set add england squad fourth test india regain full fitness , head coach chris silverwood say sunday .",12
67,"discount curb : maruti fin r  crore cci < img border= ''  '' hspace= ''  '' align= '' left '' style= '' margin-top:px ; margin-right:px ; '' src= '' http : //timesofindia.indiatimes.com/photo/.cms '' / > fair play watchdog competition commission india ( cci ) impose r -crore penalty top car maker maruti suzuki centrally control restrict dealer discount , say practice lead “ denial benefit ” buyer , lower competitive fightback auto industry .",2
68,tamil nadu school reopen date release august  < a href= '' http : //timesofindia.indiatimes.com/home/education/news/tamil-nadu-schools-reopening-date-to-be-released-by-august-/articleshow/.cms '' > < img border= ''  '' hspace= ''  '' align= '' left '' style= '' margin-top:px ; margin-right:px ; '' src= '' http : //timesofindia.indiatimes.com/photo/.cms '' / > < /a > the tamil nadu government would take 'final ' decision reopen school class nine  august  .,1
69,"crime criticism west bengal west bengal , congress spokesperson sanmoy bandopadhyay arrest allegedly torture post social medium view critical chief minister mamata banerjee nephew abhishek banerjee .",6
70,"delhi :  % student per classroom , stagger lunch break among ddma guideline reopen < a href= '' http : //timesofindia.indiatimes.com/home/education/news/delhi--students-per-classroom-staggered-lunch-breaks-among-ddma-guidelines-for-reopening/articleshow/.cms '' > < img border= ''  '' hspace= ''  '' align= '' left '' style= '' margin-top:px ; margin-right:px ; '' src= '' http : //timesofindia.indiatimes.com/photo/.cms '' / > < /a >",1
71,"racial abuse australia , eng fan throw ball siraj < img border= ''  '' hspace= ''  '' align= '' left '' style= '' margin-top:px ; margin-right:px ; '' src= '' http : //timesofindia.indiatimes.com/photo/.cms '' / > have face racial abuse australia , india  new pace sensation mohammed siraj wednesday spectator `` throw ball him '' fielding boundary line , reveal teammate rishabh pant end first day  play third test england .",5
72,"england stupid tactic , india brilliant : boycott < img border= ''  '' hspace= ''  '' align= '' left '' style= '' margin-top:px ; margin-right:px ; '' src= '' http : //timesofindia.indiatimes.com/photo/.cms '' / > ​england , start day  lord  test strong position , eventually lose game  run `` brilliant '' india . word exchange regularly player india fed intense atmosphere lift game host get sidetrack .",5
73,"`` i lose  kg pcos go dairy-free '' < img border= ''  '' hspace= ''  '' align= '' left '' style= '' margin-top:px ; margin-right:px ; '' src= '' http : //timesofindia.indiatimes.com/photo/.cms '' / > diagnose pcos hashimoto  disease , -year-old jasleen kaur decide lose weight holistic way , decide swap medicine ayurvedic lifestyle !",3
74,"india didn ’ t deviate central theme team self : laxman < img border= ''  '' hspace= ''  '' align= '' left '' style= '' margin-top:px ; margin-right:px ; '' src= '' http : //timesofindia.indiatimes.com/photo/.cms '' / > the incredible nature virat kohli & co  comeback , first run out-of-form cheteshwar pujara ajinkya rahane wag tail , speaks volume team effort , former india batsman vvs laxman feel central theme india  memorable win 'home cricket ' .",5
75,"jan dhan account hit  crore  year , deposit . lakh crore < img border= ''  '' hspace= ''  '' align= '' left '' style= '' margin-top:px ; margin-right:px ; '' src= '' http : //timesofindia.indiatimes.com/photo/.cms '' / > the centre saturday say communicate bank plan ensure coverage jan dhan account holder various micro insurance scheme pm narendra modi say government ’ s financial inclusion initiative transform country ’ s development trajectory help deepen transparency . august  , number total pmjdy account  crore . % ( . crore ) jan dhan account holder woman . % ( . crore ) rural semi-urban area .",2
76,"lignite mining trigger tremor bhavnagar district , gujarat even lignite mining operation seismically unstable region bhavnagar district gujarat cause mild tremor sudden elevation patch surround farmland , state administration responds ‘ alarm silence ’ .",7
77,"nobel laureate venki ramakrishnan discus covid- , vaccination , science education india , among thing interview venki ramakrishnan , structural biologist winner  nobel prize chemistry .",9
78,"cusat cat  result , rank list release admissions.cusat.ac.in < a href= '' http : //timesofindia.indiatimes.com/home/education/news/cusat-cat--result-rank-list-released-at-admissions-cusat-ac-in/articleshow/.cms '' > < img border= ''  '' hspace= ''  '' align= '' left '' style= '' margin-top:px ; margin-right:px ; '' src= '' http : //timesofindia.indiatimes.com/photo/.cms '' / > < /a >",1
79,jofra archer aim test return west indie < img border= ''  '' hspace= ''  '' align= '' left '' style= '' margin-top:px ; margin-right:px ; '' src= '' http : //timesofindia.indiatimes.com/photo/.cms '' / > england fast bowler jofra archer still believe test future target return five-day format next year  tour west indie .,5
80,student secure  % mark bengal board exam eligible scholarship scheme : cm mamata banerjee < a href= '' http : //timesofindia.indiatimes.com/home/education/news/students-securing--marks-in-bengal-board-exams-eligible-for-scholarship-scheme-cm-mamata-banerjee/articleshow/.cms '' > < img border= ''  '' hspace= ''  '' align= '' left '' style= '' margin-top:px ; margin-right:px ; '' src= '' http : //timesofindia.indiatimes.com/photo/.cms '' / > < /a >,1
81,"colour heaven indian team birder brave swampy mountainous terrain papua new guinea photograph bird paradise , particular spectacular raggiana .",7
82,"agnes smedley : ‘ daughter earth ’ novelist , feminist world revolutionary agnes smedley reject “ ordain social hierarchy ” follow radical path self-discovery . consider earth “ share common treasury ” help create “ new form interiority sociability ” , mark new “ utopian geography ”  .",5
83,"faulty prescription cite grave misuse oxytocin milch animal , centre restricts manufacture retail sale drug use prevent postpartum haemorrhage excessive bleeding childbirth .",8
84,china ban exam six-year-olds beijing retools education system < a href= '' http : //timesofindia.indiatimes.com/home/education/news/china-bans-exams-for-six-year-olds-as-beijing-retools-education-system/articleshow/.cms '' > < img border= ''  '' hspace= ''  '' align= '' left '' style= '' margin-top:px ; margin-right:px ; '' src= '' http : //timesofindia.indiatimes.com/photo/.cms '' / > < /a >,1
