,text,category
980,"cod app ceo lash apple , receives apology later < a href= '' http : //timesofindia.indiatimes.com/gadgets-news/coding-app-ceo-lashes-out-at-apple-receives-apology-later/articleshow/.cms '' > < img border= ''  '' hspace= ''  '' align= '' left '' style= '' margin-top:px ; margin-right:px ; '' src= '' http : //timesofindia.indiatimes.com/photo/.cms '' / > < /a > hopscotch app ceo samantha john recently share long thread twitter share tough time face submit update app . unaware , hopscotch cod app kid .",10
981,"ongc evaluate stake buy russia  vostok oil project < img border= ''  '' hspace= ''  '' align= '' left '' style= '' margin-top:px ; margin-right:px ; '' src= '' http : //timesofindia.indiatimes.com/photo/.cms '' / > india  oil natural gas corp evaluate purchase stake russia  massive vostok oil project , company official say thursday , two country seek deepen economic tie energy sector .",2
982,science peel adhesive tape experiment extensive image seemingly smooth act peel tape surface suggest far simple . involves multip,9
983,"amid rise power demand , coal stock  plant ‘ critical ’ < img border= ''  '' hspace= ''  '' align= '' left '' style= '' margin-top:px ; margin-right:px ; '' src= '' http : //timesofindia.indiatimes.com/photo/.cms '' / >",2
984,"apple may inspire google improve chromebooks < a href= '' http : //timesofindia.indiatimes.com/gadgets-news/how-apple-may-have-inspired-google-to-improve-its-chromebooks/articleshow/.cms '' > < img border= ''  '' hspace= ''  '' align= '' left '' style= '' margin-top:px ; margin-right:px ; '' src= '' http : //timesofindia.indiatimes.com/photo/.cms '' / > < /a > google ’ s chromebooks — recently become quite popular global pc market — may soon come run chipsets design google . report nikkei asia , company develop processor chrome os-powered laptop tablet in-house .",10
985,"apple launch free service program iphones < a href= '' http : //timesofindia.indiatimes.com/gadgets-news/apple-has-launched-free-service-program-for-these-iphones/articleshow/.cms '' > < img border= ''  '' hspace= ''  '' align= '' left '' style= '' margin-top:px ; margin-right:px ; '' src= '' http : //timesofindia.indiatimes.com/photo/.cms '' / > < /a > the service cover iphone  iphone  pro model . however , iphone  iphone  pro model eligible . affected device may include manufacture october  april  .",10
986,"leopard reflect decade ’ s worth research , conservation biologist sanjay gubbi ’ s authoritative book leopard handbook big cat , naturalist ’ s diary , conservationist ’ s primer collection yarn jungle .",7
987,make delhi world leader skill training : manish sisodia < a href= '' http : //timesofindia.indiatimes.com/home/education/news/will-make-delhi-a-world-leader-in-skill-training-manish-sisodia/articleshow/.cms '' > < img border= ''  '' hspace= ''  '' align= '' left '' style= '' margin-top:px ; margin-right:px ; '' src= '' http : //timesofindia.indiatimes.com/photo/.cms '' / > < /a >,1
988,conservation happiness mincha wangdi start educationist environmental concept qualification acquire university leeds master ’ s sci,7
989,'we look fast bowler ' workload purely series ' perspective ' < img border= ''  '' hspace= ''  '' align= '' left '' style= '' margin-top:px ; margin-right:px ; '' src= '' http : //timesofindia.indiatimes.com/photo/.cms '' / > prasidh krishna  inclusion main squad `` precautionary measure '' india  bowling coach bharath arun wednesday say look workload management fast bowler purely perspective ongoing series .,5
990,"fast universe expand ? university chicago astronomer make new measurement fast universe expand , use entirely different kind star pre",9
991,"education ` education all ' conference held recently delhi , india appeal additional foreign fund educate child . countr",1
992,"carlyle may buy hexaware $  billion < img border= ''  '' hspace= ''  '' align= '' left '' style= '' margin-top:px ; margin-right:px ; '' src= '' http : //timesofindia.indiatimes.com/photo/.cms '' / > private equity giant baring asia , own software firm hexaware technology , set pick $ -billion offer carlyle group city-based company , accord person direct knowledge matter .",2
993,"help hand mumbai metropolitan area surroundings , resqink association wildlife welfare hand full lockdown , rescue  animals—reptiles , bird mammals—between january june year .",7
994,"wrangle fee maharashtra mumbai fee charge private professional college continue plague admission scene maharashtra , college",1
995, school include 'realisation ' curriculum < a href= '' http : //timesofindia.indiatimes.com/home/education/news/-up-schools-to-include-realisation-curriculum/articleshow/.cms '' > < img border= ''  '' hspace= ''  '' align= '' left '' style= '' margin-top:px ; margin-right:px ; '' src= '' http : //timesofindia.indiatimes.com/photo/.cms '' / > < /a >,1
996,"neet : rajan committee submits report , ball tamil nadu government ’ s court a.k . rajan committee constitute study impact national eligibility cum entrance test socially backward student submit report , onus state government get exemption tamil nadu pre-medical entrance examination .",1
997,"sars epidemic even sars virus arrives india , first case report goa , laboratory continue explore way co",8
998,manipal arogya card enrolment begin < a href= '' http : //timesofindia.indiatimes.com/home/education/news/manipal-arogya-card-enrolment-begins/articleshow/.cms '' > < img border= ''  '' hspace= ''  '' align= '' left '' style= '' margin-top:px ; margin-right:px ; '' src= '' http : //timesofindia.indiatimes.com/photo/.cms '' / > < /a >,1
999,"ldf confident second inning kerala bolster resound victory local body election , udf disarray , ruling left democratic front exudes hope secure second consecutive term office .",6
1000,judicial outburst government really deserve harsh rebuke get chief justice india response verdict profess,1
1001,"amitabh bachchan : endure icon although film career amitabh bachchan , recently confer dadasaheb phalke award lifetime achievement , peaked s s , accomplish post- deserves great credit .",5
1002,"odisha mla finally clear class  board exam age  < a href= '' http : //timesofindia.indiatimes.com/home/education/news/odisha-mla-finally-clears-class--board-exams-at-the-age-of-/articleshow/.cms '' > < img border= ''  '' hspace= ''  '' align= '' left '' style= '' margin-top:px ; margin-right:px ; '' src= '' http : //timesofindia.indiatimes.com/photo/.cms '' / > < /a > odisha mla purna chandra swain finally clear class  board exam , age  .",1
1003,"india asks utility import coal amid short supply < img border= ''  '' hspace= ''  '' align= '' left '' style= '' margin-top:px ; margin-right:px ; '' src= '' http : //timesofindia.indiatimes.com/photo/.cms '' / > india urge utility import coal despite world  fourth-largest reserve , several power plant verge run fuel due surge power demand .",2
1004,criminal trial questionable drug trial mentally challenged person doctor indore emphasise need strict enforcement medical ethic .,8
1005,"heart attack get common  < img border= ''  '' hspace= ''  '' align= '' left '' style= '' margin-top:px ; margin-right:px ; '' src= '' http : //timesofindia.indiatimes.com/photo/.cms '' / > preliminary report suggest actor , know role television show , balika vadhu suffer sudden heart attack claimed life .",3
1006,"central bank mandate 'green ' investment : rajan < img border= ''  '' hspace= ''  '' align= '' left '' style= '' margin-top:px ; margin-right:px ; '' src= '' http : //timesofindia.indiatimes.com/photo/.cms '' / > onus promote sustainable investment lie government central bank , already significant policy commitment , say raghuram rajan , former reserve bank india ( rbi ) governor .",2
1007,"water hold dna together researcher chalmers university technology , sweden , discover new feature way deoxyribonucleic acid ( dna ) bind itself , r",9
1008,"sarus crane : walk tall wetland north india sarus crane , know love since ancient time extreme fidelity dramatic dance ritual , disappear india ’ s neighbourhood somehow survive country , mainly wetland uttar pradesh .",7
1009,trail bowerbird team international birder go papua new guinea photograph endemic flame bowerbird mating ritual “ dance ” .,7
1010,"mastodon : new social medium platform social medium aficionado unhappy platform twitter various reason new option , mastodon .",9
1011,gamma ray get energy boost pair distant explosion discover nasa ’ s fermi gamma-ray space telescope neil gehrels swift observatory produce highest-energy,9
1012,"kashmir , imperilled zone peace tosamaidan , high-altitude pastureland kashmir ’ s budgam district recently site fire range indian army virtual death trap civilian , today symbol community-driven sustainable living .",7
1013,"china celebrates th anniversary found communist party china communist party china celebrates centenary , president xi jinping highlight role alleviate poverty make country strong united .",0
1014,iso certification team appreciates standard ttd educational institution < a href= '' http : //timesofindia.indiatimes.com/home/education/news/iso-certification-team-appreciates-standards-at-ttd-educational-institutions/articleshow/.cms '' > < img border= ''  '' hspace= ''  '' align= '' left '' style= '' margin-top:px ; margin-right:px ; '' src= '' http : //timesofindia.indiatimes.com/photo/.cms '' / > < /a >,1
1015,"india verge second covid wave ? steady nationwide surge case , even vaccination drive way , raise legitimate concern india may verge second wave .",8
1016,"douglas stuart write loss & love < img border= ''  '' hspace= ''  '' align= '' left '' style= '' margin-top:px ; margin-right:px ; '' src= '' http : //timesofindia.indiatimes.com/photo/.cms '' / > booker prize  winner douglas stuart grace time litfest along author ira mukhoty , ask really deep meaningful question .",3
1017,‘ bling-bling ’ sing sing : calamitous fall nicolas sarkozy conviction former president corruption charge major humiliation french state .,0
1018,"india train doctor infectious disease india battling swine flu , eminent indian-american doctor say right time government country accelerate process training doctor infectious disease else could late bring situation control .",8
1019,"th test : shardul lone bright spot another debacle , bumrah strike back < img border= ''  '' hspace= ''  '' align= '' left '' style= '' margin-top:px ; margin-right:px ; '' src= '' http : //timesofindia.indiatimes.com/photo/.cms '' / > shardul thakur  counter-attacking half-century good enough save indian batting another embarrassment jasprit bumrah  menace opening spell kept visitor even keel england opening day fourth test . stump , england   response india   , lose opener rory burn (  ) haseeb hameed (  ) in-form skipper joe root (  ) .",5
1020,"jharkhand : discord ruling front promise jmm ’ s election manifesto , hemant soren withdrawn case relate pathalgadi movement . congress , alliance partner state , object blanket withdrawal .",6
1021,"smith set play ipl , finch track recover time t wc < img border= ''  '' hspace= ''  '' align= '' left '' style= '' margin-top:px ; margin-right:px ; '' src= '' http : //timesofindia.indiatimes.com/photo/.cms '' / > star australian batsman steve smith , sideline due elbow injury , expect make return ipl , limited over team skipper aaron finch track recover time t world cup .",5
1022,"taliban gain ground , u.s. make hasty exit afghanistan ahead september  deadline last batch u.s. troop make quick exit bagram base near kabul much ahead september  deadline , mark end -year occupation amid advance taliban across country .",0
1023,celebrate integration french team ’ s unity need percolate everyday life nation guide force today ’ s fragment world .,4
1024,"horse & elephant help india first test win eng < img border= ''  '' hspace= ''  '' align= '' left '' style= '' margin-top:px ; margin-right:px ; '' src= '' http : //timesofindia.indiatimes.com/photo/.cms '' / > when england india meet oval fourth test thursday ,  year since india  triumph south london ground saw first match series win english soil .",5
1025,gujarat :  % teacher take part govt  preparedness survey < a href= '' http : //timesofindia.indiatimes.com/home/education/news/gujarat--teachers-take-part-in-govts-preparedness-survey/articleshow/.cms '' > < img border= ''  '' hspace= ''  '' align= '' left '' style= '' margin-top:px ; margin-right:px ; '' src= '' http : //timesofindia.indiatimes.com/photo/.cms '' / > < /a >,1
1026,"comedk uget admit card  release , here  download link < a href= '' http : //timesofindia.indiatimes.com/home/education/news/comedk-uget-admit-card--released-heres-download-link/articleshow/.cms '' > < img border= ''  '' hspace= ''  '' align= '' left '' style= '' margin-top:px ; margin-right:px ; '' src= '' http : //timesofindia.indiatimes.com/photo/.cms '' / > < /a >",1
1027,"wistron tie optiemus boost production < img border= ''  '' hspace= ''  '' align= '' left '' style= '' margin-top:px ; margin-right:px ; '' src= '' http : //timesofindia.indiatimes.com/photo/.cms '' / > in major development electronics manufacturing space , $  billion taiwanese global contract supplier wistron announce strategic partnership homegrown optiemus electronics manufacture mobile phone , hearables wearable , hardware laptop , g component electric vehicle part .",2
1028,blame dispenser assam human right commission indicts state government vitamin a-related death  child november .,8
1029,"xiaomi start roll new o update globally : first  phone receive < a href= '' http : //timesofindia.indiatimes.com/gadgets-news/xiaomi-to-start-rolling-out-new-os-update-globally-these-are-the-first--phones-that-will-receive/articleshow/.cms '' > < img border= ''  '' hspace= ''  '' align= '' left '' style= '' margin-top:px ; margin-right:px ; '' src= '' http : //timesofindia.indiatimes.com/photo/.cms '' / > < /a > miui . enhance update come liquid storage mechanism say keep system vibrant responsive time . besides this , fe",10
1030,management education nurture entrepreneurship < a href= '' http : //timesofindia.indiatimes.com/home/education/news/management-education-nurturing-entrepreneurship/articleshow/.cms '' > < img border= ''  '' hspace= ''  '' align= '' left '' style= '' margin-top:px ; margin-right:px ; '' src= '' http : //timesofindia.indiatimes.com/photo/.cms '' / > < /a >,1
1031,"lose antiquity stroll ancient greek ruin delphi athens . navel-gazing could make dizzy , warns nikoleta , guide , tongue-in-ch",11
1032,"m diabetic india  : study < a href= '' http : //timesofindia.indiatimes.com/m-diabetics-in-india-by--study/articleshow/.cms '' > < img border= ''  '' hspace= ''  '' align= '' left '' style= '' margin-top:px ; margin-right:px ; '' src= '' http : //timesofindia.indiatimes.com/photo/.cms '' / > < /a > india head towards diabetic explosion  million people affected  , decade ahead expectation .",8
1033,tn set apart . % preferential quota govt school student admission professional course < a href= '' http : //timesofindia.indiatimes.com/home/education/news/tn-sets-apart---preferential-quota-for-govt-school-students-in-admission-to-professional-courses/articleshow/.cms '' > < img border= ''  '' hspace= ''  '' align= '' left '' style= '' margin-top:px ; margin-right:px ; '' src= '' http : //timesofindia.indiatimes.com/photo/.cms '' / > < /a >,1
1034,"give rishabh pant space need , say virat kohli < img border= ''  '' hspace= ''  '' align= '' left '' style= '' margin-top:px ; margin-right:px ; '' src= '' http : //timesofindia.indiatimes.com/photo/.cms '' / > india skipper virat kohli saturday back under-fire wicketkeeper rishabh pant , say team management give space need remainder five-test series england .",12
1035,"ambani ’ s green push stop oil boost $ bn fortune < img border= ''  '' hspace= ''  '' align= '' left '' style= '' margin-top:px ; margin-right:px ; '' src= '' http : //timesofindia.indiatimes.com/photo/.cms '' / > along arabian sea , jamnagar money-making machine asia ’ s richest man , mukesh ambani , processing crude oil fuel , plastic chemical . it ’ s also billionaire make new bet : $  billion investment green energy .",2
1036,allows private varsity open off-campus centre < a href= '' http : //timesofindia.indiatimes.com/home/education/news/up-allows-private-varsities-to-open-off-campus-centres/articleshow/.cms '' > < img border= ''  '' hspace= ''  '' align= '' left '' style= '' margin-top:px ; margin-right:px ; '' src= '' http : //timesofindia.indiatimes.com/photo/.cms '' / > < /a >,1
1037,long-lasting covid symptom rare child : lancet study < img border= ''  '' hspace= ''  '' align= '' left '' style= '' margin-top:px ; margin-right:px ; '' src= '' http : //timesofindia.indiatimes.com/photo/.cms '' / >,9
1038,duta hold protest implementation new education policy < a href= '' http : //timesofindia.indiatimes.com/home/education/news/duta-holds-protest-against-implementation-of-new-education-policy/articleshow/.cms '' > < img border= ''  '' hspace= ''  '' align= '' left '' style= '' margin-top:px ; margin-right:px ; '' src= '' http : //timesofindia.indiatimes.com/photo/.cms '' / > < /a >,1
1039,"govt extends deadline various tax compliance , vivad se vishwas payment < img border= ''  '' hspace= ''  '' align= '' left '' style= '' margin-top:px ; margin-right:px ; '' src= '' http : //timesofindia.indiatimes.com/photo/.cms '' / >",2
1040,"bowling attack deplete broad & anderson out : bairstow < img border= ''  '' hspace= ''  '' align= '' left '' style= '' margin-top:px ; margin-right:px ; '' src= '' http : //timesofindia.indiatimes.com/photo/.cms '' / > the thought go test without season pace duo stuart broad james anderson definitely good one , england  wicketkeeper-batsman jonny bairstow admit eve second match india .",5
1041,classic performance muttiah muralitharan  bowling feat oval test match sri lanka vindicate much-criticised bowling credential .,4
1042,"bird paradise indian team birder brave swampy mountainous terrain papua new guinea photograph bird paradise , particular spectacular raggiana .",7
1043,would wash snail slime soap ? < img border= ''  '' hspace= ''  '' align= '' left '' style= '' margin-top:px ; margin-right:px ; '' src= '' http : //timesofindia.indiatimes.com/photo/.cms '' / > foamy slime bubble onto damien desrocher ’ s hand lightly rub one thousand snail keep enclosure backyard .,3
1044,"lightweight india ensemble look < img border= ''  '' hspace= ''  '' align= '' left '' style= '' margin-top:px ; margin-right:px ; '' src= '' http : //timesofindia.indiatimes.com/photo/.cms '' / > muslin , linen , ikat , jamdani chanderi could well reimagined suit daily need modern consumer .",3
1045,"case make high education free high education must provide public institution completely free , allow exclusion ground impecuniousness .",1
1046,different ball game world cup  promise excite contest fascinate venue . vijay lokapally,4
1047,nd test : india aim well batting show england lord  < img border= ''  '' hspace= ''  '' align= '' left '' style= '' margin-top:px ; margin-right:px ; '' src= '' http : //timesofindia.indiatimes.com/photo/.cms '' / > captain virat kohli might seriously consider play best spinner ravichandran ashwin expect far well show season batting line-up india meet england second test lord  start thursday .,5
1048,sai recruitment  : apply online  assistant coach post < a href= '' http : //timesofindia.indiatimes.com/home/education/news/sai-recruitment--apply-online-for--assistant-coach-posts/articleshow/.cms '' > < img border= ''  '' hspace= ''  '' align= '' left '' style= '' margin-top:px ; margin-right:px ; '' src= '' http : //timesofindia.indiatimes.com/photo/.cms '' / > < /a >,1
1049,"glorious quetzal photographic encounter elusive bird cloud forest costa rica , resplendent quetzal .",7
1050,"asus expands proart content creator series : detail < a href= '' http : //timesofindia.indiatimes.com/gadgets-news/asus-expands-proart-content-creator-series-all-the-details/articleshow/.cms '' > < img border= ''  '' hspace= ''  '' align= '' left '' style= '' margin-top:px ; margin-right:px ; '' src= '' http : //timesofindia.indiatimes.com/photo/.cms '' / > < /a > asus expand product lineup launch new proart solution , window  laptop pc complete range oled display company  create uncreated launch event .",10
1051,"paralympics : shuttlers suhas , tarun win ; kohli-parmar duo loses < img border= ''  '' hspace= ''  '' align= '' left '' style= '' margin-top:px ; margin-right:px ; '' src= '' http : //timesofindia.indiatimes.com/photo/.cms '' / > indian shuttlers suhas yathiraj tarun dhillon make impressive start campaign men  single sl class second day badminton competition tokyo paralympics thursday .",4
1052,"abc facilitate graduate employability < a href= '' http : //timesofindia.indiatimes.com/home/education/news/will-abc-facilitate-graduate-employability/articleshow/.cms '' > < img border= ''  '' hspace= ''  '' align= '' left '' style= '' margin-top:px ; margin-right:px ; '' src= '' http : //timesofindia.indiatimes.com/photo/.cms '' / > < /a > academic claim open choice new scheme empower student develop full potential , quality number credit earn matter",1
1053,"important take to : tsitsipas long bathroom break < img border= ''  '' hspace= ''  '' align= '' left '' style= '' margin-top:px ; margin-right:px ; '' src= '' http : //timesofindia.indiatimes.com/photo/.cms '' / > stefanos tsitsipas backing off , much unlike hurricane ida lash across new york city wednesday night . greek take rather leisurely eight-minute bathroom break , disrupt opponent  rhythm , need it . sport spirit toilette etiquette damn .",4
1054,"success formula front crowd , , sebastian vettel win indian grand prix second time row buddh circuit . formula one",4
1055,"trace it ! short story translate telugu unusual story dappu legendary skill one play it—the madiga drummer . traditionally played ceremonial occasion , today dappu presence political meeting well . unusual story gogu shyamala",5
1056,'health simply politics mean ' james orbinski one three doctor begin canadian branch medecins sans frontieres ( msf ) ( doctor without frontier )  .,8
1057,"th test : prasidh krishna add main india squad < img border= ''  '' hspace= ''  '' align= '' left '' style= '' margin-top:px ; margin-right:px ; '' src= '' http : //timesofindia.indiatimes.com/photo/.cms '' / > karnataka speedster prasidh krishna , standby indian team past three month , wednesday add main squad ahead fourth test england .",12
1058,"apple watch series  may get all-new look , design < a href= '' http : //timesofindia.indiatimes.com/gadgets-news/apple-watch-series--may-get-an-all-new-look-design/articleshow/.cms '' > < img border= ''  '' hspace= ''  '' align= '' left '' style= '' margin-top:px ; margin-right:px ; '' src= '' http : //timesofindia.indiatimes.com/photo/.cms '' / > < /a > a head towards apple ’ s hardware event ideally take place next month , rumour upcoming apple product rife . lot say new iphone lineup turn smartwatch company . apple expect unveil apple watch series  along iphone  lineup . new leak surface online reveal design detail upcoming smartwatch .",10
1059,"alternative living , chrisitiania way christiania , “ experiment ” self-governed community living spread  acre near copenhagen , thrive alternative capitalist statist society , reminder another world possible .",11
1060,"infosys able resolve tax portal glitch sept  ? < img border= ''  '' hspace= ''  '' align= '' left '' style= '' margin-top:px ; margin-right:px ; '' src= '' http : //timesofindia.indiatimes.com/photo/.cms '' / > with return filing deadline loom , infosys , technology vendor income tax portal , able meet september  deadline fix finance minister nirmala sitharaman provide hassle free platform ? although tech giant yet comment issue , government official believe it ’ s challenge task .",2
1061,"zodiac : people admire you < img border= ''  '' hspace= ''  '' align= '' left '' style= '' margin-top:px ; margin-right:px ; '' src= '' http : //timesofindia.indiatimes.com/photo/.cms '' / > every one u unique quality define u person . positive negative personality make u be . give others pleasant impression u others make u seem arrogant , hurtful bad . people notice admirable quality . trait shine brightest . so , let ’ s know people admire you , accord zodiac sign .",3
1062,"r  : rise lpg cylinder price since january  < img border= ''  '' hspace= ''  '' align= '' left '' style= '' margin-top:px ; margin-right:px ; '' src= '' http : //timesofindia.indiatimes.com/photo/.cms '' / > the price liquify petroleum gas ( lpg ) cylinder hike yet r  wednesday , news agency ani report . second hike undertaken oil marketing company ( omcs ) within last one month . august  , price increase r  take cost . kg cylinder r . piece delhi .",2
1063,india post gd recruitment  : apply online  post & uttarakhand circle < a href= '' http : //timesofindia.indiatimes.com/home/education/news/india-post-gds-recruitment--apply-online-for--posts-for-up-uttarakhand-circles/articleshow/.cms '' > < img border= ''  '' hspace= ''  '' align= '' left '' style= '' margin-top:px ; margin-right:px ; '' src= '' http : //timesofindia.indiatimes.com/photo/.cms '' / > < /a >,1
1064,telescope throw new light saturn ’ s ring late view saturn hubble space telescope capture exquisite detail structure ring system atmospheric detail,9
1065,"export grow  % aug , trade deficit -month high < img border= ''  '' hspace= ''  '' align= '' left '' style= '' margin-top:px ; margin-right:px ; '' src= '' http : //timesofindia.indiatimes.com/photo/.cms '' / > india ’ s export grow $ . billion august ,  % high last year , faster pace increase import result trade deficit widen $ . billion , high since april .",2
